area,titles,reviews
신촌역,유어 커피, 앤틱하고 빈티지한 멋이 살아있어 사진 찍기 안성맞 춤이었어요  어떻게 찍어도 사진 예술로 나옵니다  커 피부터 디저트  맥주나 와인 위스키 같은 주류    위스키가 들어간 커피가 맛있어서 종종 들리는 곳이 에요 시나몬향이 솔솔 나면서 크림이 있어서 마시기 좋아요 샌드위치도 맛있어서 아침에 커피 한잔    술이들어간 커피라니  정말 신선한 경험이었어요  하지만 너무 맛있어서 놀랐고 브런치메뉴들이나 베이커리류들도 너무너무 좋았어요  우선 아날로그적인 감성을 좋아하는터라 세월의 흔적 이 느껴지는 아이템들과 요즘 스타일이 잘어우러진듯 한 인테리어가 좋았어요 그리고 중요한  커피    흑임자라떼 꼬숩고  바닐라빈 라떼는 많이 달지 않아 서 좋아요  친구가 아메리카노 맛있다네요  위스키 들 어간 알콜커피도 마셔봤는데 은근 쎕니다       디저트가 정말 맛있는 곳 입니다 특히 아몬드 쿠키는  밀가루가 안 들어갔는데 쫀득한 식감이 일품입니다     진짜 꼭 가셔서 샌드위치랑 커피는 꼭 드세여  넘 맛있어요  분위기도 좋고 맨날 오고 싶어요 분위기도 좋고 맛도 좋았던 로스팅 카페였어용 역에 서도 멀지 않고 조용히 머무르기도 좋고 친구들과 이 야기 하기도 좋았던 곳이에용  생각보다 넓어    로스팅하고 있을 때 방문을 해서 커피향 가득한 곳에 서 기분좋게 카피를 마시고 왔어요  파운드케이크도 샌드위치도 다다다 맛있고요    아메리카노가     인테리어도 멋지고 자리도 넘 편해요 조용한편이어서 대화하기도 좋았습니다  재방문 의사 완전 있음    장소가 분리 되어있어 집중하기에도 좋고  대화 나누 기에도 좋은 것 같아요  분위기가 모던하면서도 무드 있는게 느낌 있어 커피한잔 하기 너무 좋더라    밀크티가 너무 맛있었어요   커피도 하나하나 정성 스럽게 만들어주신 느낌이라 너무 좋았어요   파운 드케익이랑 스콘 먹었는데 둘다 맛있고 크기    대흥역카페 유어커피 조용하고 분위기 있고 새벽   시까지 영업해서 퇴근 후 데이트하기 좋은 카페예요  커피뿐 아니라 와인  칵테일  위스키  맥주도 있    위스키가 든 커피를 파는 곳이 있다고 해서 찾아왔어 요  버번위스키에 크림   에스프레소 조합이 이렇게 맛있다니       고소한 흑임자맛 제대로인 유어    커피도 맛있고 카페 분위기도 좋아서 종종 가는 곳이 에요  오늘은 에그타르트와 치즈타르트 달다구리에  커피 조합으로 힐링하고 왔어요  생각보다 아늑하고 편안한 분위기가 마음에 들었어요  커피 맛도 좋고 자리에 앉아서 대화하기 좋아요  바닐라빈 라떼 맛있네요   분위기도 좋은데다 노래도 좋아서 혼자 앉아서 시간 보내기 즐거웠습니다  다음에 또 들릴게요  커피도 크로플도 맛있어요     광흥창역 근처에 있는 유어커피입니다  굉장히 엔틱 한 느낌이 나는 카페에요     커피부터 식사류에  위스키까지 판매합니다  하마터면 위스키도 먹    집근처에 늦게까지 하는 카페 찾다가 방문했는데 편하구 좋내용    마음이 따뜻해지는 카페에요  이 근방 제 최애카페가 될 것 같아요  노래도 좋고 분위기도 좋고  조용하게  잘 즐기다 갑니닷  담에 책 한권 챙겨와서 읽    추천해요 분위기가 너무 좋아요 자주가는 최애카페  분위기도 좋고 커피도 넘 맛있어요    혼자오신분들도 많고 데이트하러오신분들도있고 집중하기 엄청 좋은 카페겸펍인거같아요 잘 놀다갑니당   공간도 예쁘고 커피도 맛있습니다  브런치 세트로 즐기면 더욱 저렴하니 갓성비네요   자주 들릴 예정이에요  특히 통새우샌드위치 넘 맛잇엇어요  분위기 맛집  친구 추천 받아 왔는데 아늑해서 독서 하기 딱 좋아요  원두도 선택 가능하다해서 담엔 다른  원두로도 먹어보려구요    고수의 분위기가 느껴지는 까페  알바분이 친절하시진않지만 딱히 불친절하지도 않은 독특한 느낌    뭐그래도 커피가 맛있으니 패쓰      주말 비도오고 그래서 낮에 가볍게 한잔하고 싶은데  친구들은 카페가고 싶다해서 어디갈까 고민하다 방문 했어요    주문한 칵테일 달달하고 맛있어요 분    신수동 카페 유어커피 대흥역 카페 대관  앤틱 가구들 이 반겨주는 유어커피 다양한 테이블과 의자가 느낌 이 다 달라요  대관있을 수 있으니 꼭 확인하기    점심대용으로 새우샌드위치랑 아이스크림크로플먹었는데 새우넘바삭하고 크로플도 부드럽고 맛있었어요  진한치즈케이크랑 에그타르트도 추천해요 인테리어도 너무 예쁘고 커피도 정말정말 맛있어요     핫도그도 소세지 팡팡 터지는게 진짜 꿀맛    원두 도 다양하게 구매할 수 있고 사장님도 너무 친     핫도그 세트      원 우선 핫도그부터    크읍    점심시간이라 시켜서 노나먹었는데 빨간 소스가 케 찹이 아니더라고요     살짝 매콤하니 기름지    좋아요  커피와 가벼운 술 그리고 디저트까지 즐길수 있는 유 어커피  매장 인테리어도 멋지고 음악도 좋아서 분위 기를 즐기면서 여유로운 시간을 보낼 수 있어    반려견과 함께 갈 수 있는 맛있는 카페 여기 인테리어 너무 특이하고 앤틱하고 젛았어오  매 장이 생각보다 넓어서 엄마랑 방문핬는데 열심히 수 다 떨다가 왔네요  그이고 커피도 맛있아사 잘     유어커피  향긋한 커피와 술이 있고 재즈음악이 있는 카페  지인이랑 처음 방문 했는데 커피맛이 올      너무 부드럽다  최고의 맛으로 리필하고     커피가 진짜 맛있어요 디저트도 다양해서 좋았는데 저는 먹은 것 중에서 통새우 샌드위치가 젤 맛있었어요 따끈따끈하고 존맛탱   매장도 청결하고 무엇보다도 커피와 크로플 새우샌드 위치 너무 맛있었어요   분위기도 너무 좋더라구요   위스키와 커피의조합이 너무 훌륭했고 바닐라    분위기 좋아요  레몬티 맛있습니다  이야기하기에도  책읽기에도 좋아요  동네 커피맛집인 거 같아요   음료도 너무 맛있고 카 페 분위기도 조용하고 매장이 큰편이라 친구랑 시간 보내기도 좋았어요  드립백도 팔고있어서 구매    요즘 밤늦게까지 하는 카페 찾기 진짜 힘든데    단비 같은 곳이었습니다 심지어 알콜커피꺼지잇어서 너무 신기햇어요       진밤맛이 너무약한게     대흥역 베이커리 카페 맛집 유어커피  이곳의 시그니 처인 유어알코올커피는 기존의 비엔나커피 이상의 진 한 풍미가 느껴지는 술이 들어간 커피입니다      산책나왔다가 매장이 예뻐보여서 들린 대흥역 카페 알코올 커피가 있어 주문해 봤는데 위에 올라간 크림 덕분에 달콤쌉싸름한 맛이 완전 취저      브    다양한 음료와 공간  음악이 어우러져 맘에 꼭 든 카 페였습니다  포근하고 아늑해서 우리동네에도 있으면 좋겠다고 생각했어요      커피 볶는 향과 따    유어커피 커피와 술과 디저트가 함께하는 곳  분위기 도 넘 좋고  친절하고  맛있어서 좋아요  스콘 왤케 맛 있나요     넘 맛있어서 하나 더 포장했어요  카    신수동 지나가면서 몇번 보다가 이번에 가봤은데 카 페도 넓고 유럽풍 가구들이 정말 고급스러워서 집으 로 데리고 가고 싶었어요   커피도 직접 로스팅    알코올 커피는 조금 도수가 있는 편이지만 하이볼은 편하게 마시기 좋은 도수  달달한 거 좋아하면 하이볼 추천해요  밀크티는 조금 특이한 맛인데 맘에     커피 맛집이지만 알코올이 들어간 커피도 맛있고요   하이네켄이나 코로나도 있어요  세트메뉴 가성비는  최고입니다  자리도 편해요 커피에 알콜 술이 들어간것도 특색잇구 레몬하이볼도 엄청 맛잇어요  여기에 수제핫도그랑 같이 먹는거 추천  소세지를 직접만든다고해요  잠시 들려 혼카페 하기에 좋았어요    각종 구움과자 대흥디저트카페 이면서 직접 로스팅한 드립백도파는 대흥로스터리카페 야외테라스석이 준 비되있는 대흥역 카페 유어커피   새벽 시까지     좋아요 좋아요 여기는 크림 타르트 정말 너무 핵존맛탱임   새벽 두시까지 하는 소중한 카페예요  주류도 팔고 구 움과자들도 있어서 공부하면서 시간보내기 딱 좋습니 다    실제로 작업이나 과제하는 분들이 많    우드  유럽풍 인테리어가 조화롭고 커피향이 넘 좋아 서 행복한 시간 보냈습니다   시그니쳐 커피하고 샌 드위치  크로플까지 다 맛있었고 넘 친절하셔    가구와 인테리어가 너무 멋져요  근데 커피랑 음료들 까지 맛나고  시넘으면 뒷쪽 주차장에 주차까지 가능 한 멋진곳   아메리카노  통팥밀크쉐이크 신상   에타  스콘  파운 드케이크 주문  아메리카노 가격이 착하고 맛있어요   맛있어서 리필도 했구요   일행이 리필해    알코올커피 처음 마셔봤는데 특이해요 커피맛나는데 알딸딸해져요     마지막엔 거의 술맛만 나지만  도전해볼만합니다   샌디치도 맛있었고 엔틱한    집앞이여서 자주가는데 늦게까지 커피숍 운영을 해서 좋구요  와인같은것도 밤에 마실수 있는거 같아요   매장이 넓지는 않은데 힙한 느낌  커피는 진하    애견동반이 가능해서 너무좋은곳  음료도 디저트도  다 너무 맛있어요  앉을 자리도 많고 혼자 혹은 친구 와 공부하러 오시는 분들도 꽤 많네요  사진찍기 너무좋은 곳이고 날이좋으면 야외테라스에 서 음료마시면 너무좋을것같아요  치즈케이크도 부드 러우면서 꾸덕해서 맛이 좋았고  생각보다 느    우연히 들렀는데 맛있고 매우 친절하셔용     커피 맛나고 파운드케이크와 크림 조화 굿  인테리어 빈티지 함 그리고 조명 맛집이기도 해요 특유의 분위기가 멋잇는 곳입니다  친구 데려와서 이 야기 나누거나 창의적인 작업할 때가기 좋아요  늦게 까지 영업하고 음식도 베이커리 샌드위치 커피    정말 맛있게 잘 먹멋 었어요  이르샌드위치와 새우튀김 세트 그리고 알콜커피까지 너무 맛있어요 예전에 급히 테이크아웃하느라 안에 못들렸는데 안은 더 멋지더라구용   분위기도    잔잔하게 집중하기 좋은 공간이네요 작업하기 좋은 분위기이고 커피와 디저트가 맛있어요  영업시간이 길어서 좋아요  아늑하고 따듯한 분위기에 음료와 음식 전부 맛있어서 여유로운 시간을 보내기에 너무 좋았어요  좋아요  서울역으로   개 세트 단체주문한 사람입니다  직접 박스로 가져다주시고 친절하세요  맛있는 디저트와 커피 만족스럽습니다  커피맛집 디저트맛집  서강대 근처의 대흥역에서 가기 좋은 조용한 동네 카페로 강추해요   인테리어가 멋지구 공간도 은근    넓어요    늦은시간까지 대화 할수 있어서 좋아요 커피 맛있어요 스콘이랑 에그타르트 강추요 스콘은  잼이랑 버터의 환상조합이 미쳤어요 에그타르트도 필 링이 흘러내리지 읺고 쫀득하니 넘 맛나요 커피에 진심이였던 곳 알코올커피 맛나네요 잘 먹고  갑니당    사장님도 너무 친절하세요    분위기도 좋고 커피도 맛있어요 양 많아서 좋아요        흑임자라떼도 존맛  반려동물과 함께 할 수 있는 카페라 너무 좋아요  늦은 시간까지 운영하고 있어서 밤늦은 시간에도 편하게 찾아갈 수 있어요  이야기 나누기도 혼자 작업하기도 좋은 공간같아요   새벽까지도 한다니 언제 밤에 한 번 와보아야겠어요     아 커피도 맛있습니다  화장실은 재정비    늦게까지 해서 너무 좋아요    커피가 맛있고 칵테일과 하이볼도 맛있습니다  알콜커피랑 하이볼먹으러오세영  음료가 맛있고 분위기 짱 좋아욥 빈티지하고 넓은 공간이 마음에 들어 자주 방문하는 카페에요 다만 아쉬운 점이 있어 리뷰 남겨요 얼마전 평일 늦은 오후에 방문했을 때 잔에 앞뒤로 립    커피도 샌드위치도 너무 맛있고 좋아요   핫도그 맛있오용 커피  분위기  인테리어 좋아요 대화 나누기 좋아요 에스프레소 커피가 맛있어요  집가까이 분위기 좋은 카페가 있어 좋아요 좋아요 코로나 이 후 첫 모임으로 방문하였는데 장소가 넓어 져서 대화하기 좋고 커피  음료가맛있어요  직원분들  친절합니다    커피맛도 괜찮고 직원분들도 친절하심  대체적으로 조용해서 좋음 커피가 맛있었어요 작은 조명들이 참 예쁜 곳  테이블도 의자도 각각 너무 매력있어요  조용하니 작업하기 좋구 이야기 나누기도 좋아요 굿 지나가다 들린거라 기대안했는데  핫도그도 커피도 엄청 맛있네요 맛있어요 좋아서 가끔 와요    늦게 까지해서 좋아요 매장 음악도 굳굳 분위기 좋은 카페  간단한 식사도 가능해서 좋아요 커피 맛있어요 음악도 좋고 늦게까지 영업하시는 것도 좋아요   밤 늦게까지 영업하는 곳 찾다 가게 되었어요  기대 없이 방문 했는데 커피 굉장히 맛있고 매장 분위기도  너무나 근사했어요  자주 갈게요  핫도그 맛있어요 가게 분위기 좋구 친절하심    미드센츄리 스타일 인테리어가 멋스러움  색다른 디 져트 커피는 맛남 에이드는 살짝 싱거웠지만  말하면  다시 해주심  오래 머물다 가기 좋음  다른데보다 저렴  핫도그 엄청 맛있어요  소세지도 탱탱하고 약간 매콤 한 소스랑 달달 소스 있어서 완전 굿굿 화장실이 공용 에 허름해서 아쉽지만 스콘 쿠키 등 베이커리    커피향기가 너무 좋아요   장소에 비해 좀 가격이 높은편   크로플 맛있어요 새벽 시까지 영업이라니 멋져요 맛있어요 진한 커피라 좋아요 인테리어도 예쁘고 음료도 맛있어요   싸다 좋아요 굿
