area,titles,reviews
망원역,망원디저트카페 롤링앤필링, 점심 대용으로 라따뚜이 사먹엇어요 저번에 저녁으 로 사먹고 든든해서 넘 조아서 또 먹으러왓어요    간 단하게 먹으려고햇는데 생각보다 크고 묵직해    사장님이 친절하시고 파이가 미쳤어요    이렇게 쫜쫜쫀득한 크림 처음 봄 맛잇는 롤링파이에 주문하면 바로 슈를 가득 채워줘 요  오늘은 저녁으로 먹으려고 라따뚜이 파이를 삿 는데 파이 위에 토마토소스와 감자으깬것 갖    주문한 파이랑 음료도 맛있구 무척이나 친절하셔서 또 방문하고 싶어요  내부도 귀엽고 예뻐용 페스트리에 커스타드 크림이라니 이조합 무조건 찬성  크림이 많이 달지도 않고 부드러워요 지나다니면서 궁금했는데 드디어 먹어봤어요  어떤 맛으로 살까 고민하면서 여쭤봤는데 먼저 시식을 권 해주셔서 좋았습니다  덕분에 기대도 안 했던     딸기 롤링 파이 겉은 바삭하고   딸기 크림이 가득한데 크림이 너무 맛있어요  매장이 너무 이쁘고 귀여웠어요 파이 맛집이라고해서 들렸는데 맛있더라구요 양도 많고 직원분도 친절하 셔서 좋았어요 다음에 또 방문해서 회사 사람    매장 아기자기해서 너무 귀여웠어요 파이시켰는데 지금까지 먹어본것중에 제일 맛있었습니다 커피도 맛있었어요 사진도 이쁘게 잘나와서 만족스러웠습니다  매장이 예쁘고 퀸아망을 판다고 해서 들어왔는데 오 시자마자 다양한 커스터드크림 시식도 해주시고 설명 도 잘해주셔서 기분좋게 구매했어요  스피니치    롤링파이 먹어보고 싶었는데 저는 라따뚜이 파이를 샀는데 파이 위에 토마토소스랑 각종 야채들이랑 감 자랑 너무너무 조합이 좋았어요 심지어 배까지    롤링파이 시금치 맛이 최애지만 오늘은 라따뚜이로  파이도 넘 맛있고 친절하세요   망원역  번 출구 가까이 있는 디저트 맛집  핑크핑크 하고 귀여운 인테리어에 맛있는 파이를 파는 디저트 집입니다 사장님이 쉐프 출신이시라 단빵 짠빵    주문하면 필링을 바로 넣어주시는데 엄청 꽉꽉 넣어 주시네요  커스타드랑 스피나치 먹어보았는데 제  입맛엔 커스타드가 더 맛있었어요 파이는 엄청    망원동에 또 하나 디저트 맛집이   롤파이에 주문하 면 바로 수제로 만든 크림 넣어주시는데 존맛 시금치 맛 추천합니다 커피는 산미 적고 깔끔한 끝맛    저번에 먹고 너무 맛있어서 또 왔어요   상큼한 거 좋아하면 딸기맛 강추  커스터드 크림이랑 파이가 너무 헤비하지도 않고 조화가 잘된 맛입니다 시금치맛이 너무 궁금해서 샀습니다  겉은 바삭하고 크림은 부드럽고 완전 맛있는  녹차맛이 나요  가게도 참 예뻐요  차루 밥먹구  차로 디저트로 배채우러왔어여     모양도 동글동글한게 일단 눈으로도 즐기고 그 이후 엔 입이 즐겁습니다  저는 스트로베리 초코 롤    디저트 너무 맛있게 잘먹고왔어요 친절하시고 깨끗하고 좋았습니다 특히 파이가 너무 맛있었어요 인테리어도 아기자기해서 귀여웠어요  소금퀸아망은 처음 보는데 소금빵 안쪽 빵을 토스트 한 듯한 식감이라 아주 맛있었어요 고소담백  거기 안 에 크림 채우면 달달하고요  시금치 크림이     커스타드 크림 파이랑 아메리카노 조합으로 먹으면 아주 진하고 맛있읍니다   다른 것도 먹어보고 싶은데 크림 너무 맛잇어서 이것만 먹는중   저번에 먹    크림 듬뿍들었고 크림도 맛있고 빵 패스츄리도 맛있습니다  동료가 사다 준 스피니치 롤링파이가 계속 생각나서 방문했어요  너무 맛있어요   재방문의사      크림이너무 달아요  빵부분 맛있넹  요기 진짜맛있네요    다른 메뉴도 꼭 먹어보고싶어요      인테리어도 이쁘고 망원 자주오는데 새로생겨서 와봤는뎅 디저트도 맛있고 이뻐용 다음에 또 올게요  해외 생활을 오래해서 든든한 재료가 들어있는 파이 를 그리워했는데  파이 찐 맛집이네요  아이 데리고   분 거리 카페하모니 가는 길에 식사하러 들렀    독특하고 아늑한 분위기  필링 종류가 다양했다  취향만 맞는다면 매일 갈 수 있을 것 같다  지나가다 들려봤는데 파이 맛집이었어요 넘 맛있어요  커스터드크림 맛있어요  게다가 이곳에서만 맛볼수 있는 시금치크림  신기한건 시금치맛보다 녹차맛이납 니다    살짝 끝에서 시금치맛이 아주 살짝    지나가다가 궁금해서 먹어봤는데 달달하니 눈떠지는 맛이에요  크림도 가득하니 넘 좋아요  다른 맛도 담에 도전해봐야겠어요 시식도 기꺼이 내어주시고  무엇보다 디저트가 맛있네요 또 올게요   빵 맛있어요 예전에 와서 커스터드 파이 먹어봤는데 넘 맛있어서  또 왔어요  가게가 이쁘고 사장님 친절하시고 크림이  혜자해요    맛있어보이는 빵들이 많아요  직원분도 친절하고 집 근처라서 자주 들을거같아요  빵 종류별로 다 먹어보고싶어요     처음와보는데 시식도 권유해주시고 엄청 친절하세요 파이들도 생각보다 엄청 부드러워서 맛있고 예뻐서 선물하기 좋을거같네요   망원동 파이맛집 드디어 찾았어요  종류도 다양하고 카스타드 파이 정말 맛있더라구요 사장님도 친절하시고 매장도 아지가지한 분위기라 너무 좋았습니다 귀여운 인테리어가 눈에 잘들어왔고 파이맛집이에요  라따뚜이 파이도 너무 맛있었고 양도 생각보다 많아 서 배불렀어요 커피도 너무 맛있었습니다 종종    롤링앤필링 퀸아망과 라따뚜이 그리고 맛있는 디저트들이 많아요  매장 인테리어도 넘 이쁘구 망원역 지나가실때 꼭 들려보세요   빵 너무너무 맛있어요  핑크가게도 넘 이뿨요   다른 필링 먹으러 또 올께요 두 번째 방문입니다  지난번 크림롤을 종류별로 사 갔었는데 너무 맛있게 먹어서 다시 방문하게 되었어 요   롤링앤필링은 인테리어 분위기가 해외    가볍게 점심으로 먹으려고 라따뚜이 파이 주문했는데  바삭하고 맛있었어요  커피도 맛집이네요  처음 방문했다고 하니깐 시식도 주시고 친절하게 대 해주셨어요 커스터드 크림 파이 완전 맛있어요 주문 하자마자 바로 필링 넣어주시더라구요 외관이 너무 예뻐서 들어가본 롤링앤필링   맛있어보 이는 롤들이 가득해서 뭘 고를지 한참 고민했습니다    안에 필링을 정말 가득가득 넣어주셔서     굿 항상 회사 근처에 있는 예쁘게 생긴 디저트 가게라고 생각했는데  얼마 전에 사원 분들이 시금치 커스타드 파이 드시고 맛있다고 하셔서 너무 궁금해서     핑크핑크 너무예뻐서 들어왔어요   새로생긴 곳 인것 같은데 내부외부 엄청 신경쓰신것 같아요   라따뚜이    귀여워서 시켰는데 크림도 바로 넣어주시    기본롤링파이 맛보고 너무맛있어서 크림 녹차도 먹 었는데 진짜 맛있어요    주일에  번이상은 들리는거 같아요     바삭한식감에 느끼하지도     스피나치 맛있어 보여요    매장은 핑크색으로 귀엽고 롤링파이는 주문 받고 크림 짜셔서 겉이 바삭해요 망원 디저트 맛집 인정이네요      수제커스타드 라고 듣고 갔는데 진짜 넘 맛있는거 있죠  비쥬얼까 지         커스타드에 진심인게느껴지는 맛입    매장이 아기자기 너무 귀엽고 예뻐요   초코 크 림롤  커스터드 크림롤  스피니치 크림롤  스트로베리 크림롤 등 크림롤 종류로 다양하게 사갔는데     망원도 지나가다 우연하게 들렸는데 너무맛있어서 자 주 갈것같아요 겉은 바삭하고 안의 커스타드크림이  너무 달지도 않고 맛있네요 너무 친절하고 좋아용   퀸아망 좋아하는 저는 자주  애용하려합니다    집근처에 퀸아망 전문점이 생겨 너 무 맛있고 좋네용     소금퀸아망 맛있어용   운동하고 아침대용으로 먹으려고 왓우요  신기하고 맛잇아요  아는 분 사무실에 미팅하러 가는길에 발견  나도 몰게 들렀습니다  파이랑 크림롤  커피 포장해갔고 포장 이 이뻐서 간단하게 선물로 괜찮았습니다  다     친구가 사다준 파이 먹어보고 넘 맛있어서 직접 방문했어요    디저트가 다양하고 무엇보다 카페인테리어가 이쁘고 망원역에서 가깝게 있어서 좋은것 같아요 시금치크림에서 엥  했다가 먹고나선 오  하는맛 패키지도 넘예뻐요 핑크 레드 조합이라니   사랑할 수밖에 없는 인테리어에 디저트도 완맛입니다  사장님도 직원님도    친절하셔요 사장님이 되게 친절하시고 평소 크림 들어간 빵 은 느끼해서 잘못먹는데 여긴 느끼하지도않고 맛있어요   다음에 또 방문할 예정입니다  디저트 찐맛집  스피내치는 완전 맛있고 찐한 녹차맛 이고 딸기쨈 올라간 것도 최애입니다  음료도 괜찮고   정성이 느껴지는 파이 디저트 맛집 강추  저번에 들러보고 너무 맛있어서 재방문했어용 근처 지나갈 때마다 생각나는 맛     사장님도 너무 친절하십니다    자주 가게 될 거 같아요   첫 방문이라 어떤 메뉴를 골라야할지 고민중이었는데 친절하게 설명해주시고 시식도 주셔서 좋았어요 그리고 무엇보다 너무 맛있어요  가게도 깔끔하고 빵 비쥬얼이 정말    미쳤어요 빵집 이면서 커피도 맛있어요 아메리카노 추천  주문하면 그 자리에서 크림 넣어주십니다 새로 오픈한     퀸아망 짱맛   직원분도 친절하세요  감각적인 외관에 이끌려 들어갔습니다  커스터드 크 림롤은 구매하면 그 자리에서 넣어주었어요  다만 가 격이 많이 비싸요  사이즈나 맛 대비 비싸서 다    페스츄리의 신세계   식사 겸 디저트로 먹기 좋아요   매장도 귀욤뽀짝하네요   정말 맛있어요   처음 가면 시식도 해주신답니다   꼭 드셔보세요   시금치라는데 어떻게 말차맛이   처음와봤는데 기대되는 맛   필링 가득한 바삭바삭 달콤해서 행복해져요 맛나용 친절하고 쾌적해요   친절하시고 커스터드 참 맛있어요  디저트카페 답게 다양한 종류의 디저트들이 많이 있네요     퀸아망 너무 맛있어요  커피도 부드럽고 카페 분위기도 좋아서 데이트장소로 딱인거 같아요    너무 맛있어요  아기자기한 인테리어  맛있어요 맛있어용 디저트가 다 이쁘고 달달해요    그리고 정말 분위기도 이쁘고 사진도 잘 나옵니다   다들 꼭 한 번 가보시길 강추드립니다  오 맛있어요    크림이 달달하니 좋아요    친절하시구   굿굿
망원역,카페 메틀, 항상 지나다니면서 예쁘다 생각했는데 요번이 시간이 나서 잠깐 들렸다가 너무 만족하고 갑니다   아기자 기한 소품있는 카페를 좋아하는데 요기가 딱     집 주변이라 한번 와봤는데 카페 내부 너무 이쁘고 아 늑한 분위기라 좋아요  디저트랑 음료도 귀여운게 넘 많습니다  저는 아이스밀크티랑 솔티트 브라운    토마토바질갈레뜨 마싯어요   커피도 산미 고소 선 택 할 수 있는데 고소한 커피 좋아하시는 분들은 만 족하실거 같아요 카페 인테리어도 클쓰마스분    너무 맛있고 아늑해요   합정에 이런 곳이 있는 줄 몰랐습니다    디저트도 너무 맛있어서 다음에 또 올 거 같아요   크리스마스 분위기 담은 선물같은 공간입니다   쿠키도 맛있고 분위기가 너무 좋아요  빨간망토도랑 소품으로 트리랑 사진도 찍을 수 있어요  크리스마스 분위기 뿜뿜하고 매장 전체적으로 예쁘게 꾸며져 았어서 좋아요   음료도 맛있고 특색있는 메뉴들이 많아 좋았습니당  인테리어가 미쳤어요  핫초코 먹고싶은 느낌이라 바로 크리스마스 분위기 즐겼답니다   소품도 귀엽고  쿠키도 너무 귀여워요  분위기도 너무 좋고 새로운 메뉴도 자주 먹을 수 있어서 좋아요   올때마다 오감만족하며 갑니다  사장님도 너무너무 친절해요  벽지가 고급스러워 인상적입니다  집기들도 톤을 맞 춰 튀지 않고 색다른 분위기를 느낄 수 있습니다  직 접 만드시는 쿠키류도 맛 좋습니다  딜라이트 스퀘어 지나가다가 밖에서 봐도 인테리어가 예뻐서 들어왔어요 커피도 맛있고 사장님도 친절하시고 좋은 기억이에요    아늑하고 고급스러운 분위기도 좋구 디저트 맛있어서 종종 오는 곳이에요  원두도 선택 가능해서 좋아요   분위기가 예쁘고 귀여운 카페에요  지금은 크리스마스 테마로 꾸며놓아서 따뜻한 느낌 낭낭해요   토피넛 라떼 달달하고 맛있어요   커피가 맛있어요  분위기도 좋고  전철에서도 가까워 서 좋네요   친절해요   맛있어요  디저트도 맛잇네요   사람도 많아요  가끔 포장도 하면 좋을거 같아요  매장이 너무 이뻐요    쿠키도 정말 이쁘고 맛있어 요  무엇보다 사장님이 너무 친절하세요   다른 카페  자리 없어서 여기 왔는데 오히려 잘 왔다고 생    합정갔다가 시간 남아서 우연히 들어간 카페인데 커피 맛있고 크리스마스 분위기여서 가게가 예뻤어요 합정에서 매장이 넘 이쁜 카페를 발견했어요  피스 타치오 크림라떼 신기해서 시켜봤는데 달달하니 맛있 습니다 이색적인 커피 찾는분께 추천해요   디    친구들과 모임이 있어 합정에 왔는데 시간이 나서 들 렀어요 분위기도 재즈의 잔잔한음악도 너무좋고 커피 맛있네요   충전할수있는 자리는 두자리정도     시그니처 커피도 맛있고 초코곰라떼도 귀엽고 달달해서 좋았습니다 늘 올때마다 너무 맛난 디저트 먹으며 힐링합니다   음료도 디저트도 너무 맛나요   분위기도 좋고 음료와 디저트가 맛있어요   카페 머틀  분위기도 좋고 디저트도 특색있어요  인테리어가 너무 예쁘고 직원분이 친절하세요 크로플 세개랑 음료 두잔 시켰어요   친구와 소소하게 수다떨기 좋은 카페 같아요  커피도 맛있고 디저트도 있고 시끄럽지 않아요  접근성도 좋 네요  종종 지나갈 때마다 카페가 참 예쁘다고     커피가 넘 넘 맛있어요  아메리카노 고소한 맛 짱입 니다  토마토바질갈레뜨 맛있어요  그런데 안타깝게   월까지만 판매한데요     단골각입니다  아늑하고 예뻐요  쿠키굽는 냄새도 최고   올때마다 맛있는 디저트와 커피  음료에 힐링하고 갑니다  펫프렌들리라 더 좋아요   여기 너무 이뻐요  엄마가 크리스마스 분위기 나는 카페 가고 싶다고 하셔서 찾다가 왔는데  분위기 갑입니다   디저트들도 크리스마스 분위기 물씬 나용 친절하고 카페가 예뻐요  분위기도 좋고 편안해요  앞으로 합정올때 또 올께요   카페 메틀 분위기 너무 좋아요    카페 분위기가 너무 좋아요       크리스마스 분위기 낭낭합니다 초코 곰돌이 라떼도 너무 귀여워요 달달한 거 좋아하시는 분은 초코곰라떼 꼭 드셔보세 요   안에 마시멜로우도 듬뿍 들어있고  초코곰이 진 짜 귀여워요  초코곰에 우유 붓는 건 인스타 스    라떼의고소하고 부드러운맛 최고네요    크로플 너무 맛있었고 아메리카노도 진하지 않아 좋았습니다   또 방문할게용 가게가 너무 이뻐서 보는 재미가 있고 사장님도 친절 해요  커피는 맛있는 편인데 크로플은 사실 맛있게 하 는데가 많아서 그냥 평범했어요  크로플이 좀     직장 동료들이랑 크리스마스 인테리어가 너무 이뻐서 찾아왔어요  저는 고소한 따아를 시켰는데 향도 좋고 맛나요  다음에도 또올게요       인테리어 아기자기하고 커피 맛이써요  합정에서 찾을 수 없는 통창 있는 유럽풍 카페   커 피도 맛있는데 베이커리 맛집      다들 레몬쿠키  꼭 드세용  주차도 되고 분위기 좋고 사장님     특별한 피스타치오 관련 음료가 있어서 좋았어요  커 피도 맛있고 디저트도 예쁘고 맛있어요  디카페인 음 료도 있어서 카페인약하신들분들도 드실수 있    너무 맛있어요    분위기도 최고 크리스마스 분위기가 카페랑 너무 잘 어울려서 겨울 만 되면 찾게 된답니다    오늘 시즌 메뉴 토피넛 먹 어봤는데 진짜 너어무 맛있어요 토피넛 좋아    주말 브런치 먹으러 왔는데 갈레뜨가 너무 맛있어서 쿠키도 또 먹어버림    커피도 쿠키도 짱맛    올때마다 늘 만족해요  분위기도 맛도 늘 만족합니다  수다떨기 너무 좋은 곳이예요   맛집인정     너무나 귀여운 쿠키를 판매하는 카페입니다   선물하려구 구매했어요    음료도 맛있어요    합정에 이런 곳이 있었다니   자주왔는데 오늘 처 음 방문했어요  매장 분위기도 너무 좋고  커피도 디 저트도 맛있어요  사장님도 친절하셔서 더 좋    분위기 좋고 쿠기 귀여워여 맛있어요  쿠키가 너무 달기는 했지만 커피랑 먹으니까 어울렸다  카페 분위기도 좋았다   크리스마스 기념으로 왔는데 가게가 아늑해서 좋았어요  커피도 맛있네요    커피 넘 맛나요 쿠키도 맛있어서 잔뜩 포장해갑니다  분위기도 좋아서 추천해요   곰돌이 라떼 달달하구 귀여워요   분위가 좋고 맛이 있어요 초코라떼가 달달한게 당수치가 올라가요 다음에 또 올게용    트리도 예쁘고 분위기도 좋고 아아도 맛있어용  합정에 약속이 있으면 꼭 오는 카페  커피도 음료도  마싰고 디저트가 진짜 고급스럽게 맛있음 인테리어가 멋져서 체인 카페들 사이에서 빛나는 소중한     너무 예쁘고 따뜻하고 크리스마스 감성 터져요   친절하시구 크리스마스 분위기 너무 좋아용  청포토 민트티도 엄청 맛있고 크로플도 맛있어요  크로플이 맛있고 크리스마스 인테리어가 예뻐서 분위기도 좋아요   커피 종류가 많아서 좋아요 이쁜 빵들 엄청 많거 크리스마그 분위기 나서 좋습니댜      음료 너무 맛있고 주차도 편해요   카페가 너무 예쁘고 음료 맛있어요   크리스마스 분위기로 아기자기 꾸며져있어서 구경하는 재미가 있어서 즐거웠습니다  디저트도 귀엽고 맛있고 크리스마스 느낌 너무 좋아요 직원분도 친절하시고 짱짱 토피넛라떼 맛있네요 매장이 크진 않지만  편한 분위기에 잘 쉬다 갑니다  카페 분위기가 너무 좋아요    크리스마스 그 자체      커피도 맛있고 쿠키도 맛있고 분위기도 좋아요  카페메틀 합정역 바로 앞에 있는 카페인데 지하철역 과 가까워 접근성이 좋아요     버스에 내리자마 자 폭염날씨로 후다닥 들어갔어요      인    분위기 대박 너무 좋아요    엄마랑 넘 행복하게 데이트중    오랜만에 왔는에 역시나 였어요   늘 새로운 메뉴에 감동하고 분위기에 취해 즐기다 갑니다  펫프렌들리라 더 좋아요   크리스마스 분위기 내기에 완벽한 카페예요  너무너무 예쁘고 사장님도 친절하고 덕분에 좋은 시간 보내고 가요      분위기 좋고 아기자기하고 아늑해요   넘넘 귀엽고 아기자기한 카페에요   분위기 좋아요  근데 초코곰라떼는 너무 달아요   합정에서 은근 찾기 힘든 분위기  아늑하고 커피 맛있음 여유롭게 브런치먹기 너무 좋아요  커피맛있는건 말모말모 동네에서 애정하는 카페   크리스마스 분위기 물씬 나는 인테리어도 좋았고 커피도 맛있어요  다음엔 커피 말고 디저트도 먹어보려구요   역 출입구쪽에 있는 감성 인테리어 카페에요  이쁘고 디저트 메뉴도 많아서 좋아요     시그니처 초코곰라떼 메틀리카노 둘다 맛있어요 분위기도 너무 아늑하니 좋습니다   카페 인테리어가 너무 좋아요 크리스마스 분위기 뿜뿜 음료랑 와플도 너무 맛있어요    너무 마음에 들어요 크리스마스 분위기 제대로네요    최고최고 친절하시구 맛있구 예뻐요  커피도 맛있고 무엇보다 크림이 진짜 맛있어요  크로 필 위에 올라가있는 토핑도 진짜 푸짐해서 끝까지 맛 있게 먹었어요  시즌메뉴로 피스타치오 메뉴도    초코곰 라떼 넘 이뻐용 합정역에서 나오면 있는 작고 귀오운 카페 카페 분위기도 너무 좋고 디저트도 맛있고 커피 음료 다 맛있어요        아이스크림 크로플 러버로써 안먹어볼수가 없었던 피스타치오 크림 크로플   강추합니다   아메리카노도 너무 맛있어요   계절시즌 메뉴로 피스타치오 크로플 먹었어요  메뉴도 맛있고  접시랑 컵도 예뻐서 더 기분이 좋은    잔잔함과 힐링주는 카페  인테리어도 아기자기하니 예쁘고 커피도 맛있어요  항상 사람이 많아서 못 갔었는데 좋아요   밀크티와 초코라떼 먹었는데 달달하니 맛있어요  합정역을 왔다갔다 하는데 이런 곳이 있는 줄 몰랐네 요    크리스마스 장식이 이뻐요    따뜻하게 차 한 잔과 디저트 먹어도 좋을 것 같아요  매니    인테리어 넘 예쁘구  커피도 맛있어요    수박이랑 메틀 그라나따 먹었는데 수박은 상큼달달하 고 메탈그라나따는 커피랑 크림 조합이    솔티드 브라운쿠키는 촉촉꾸덕한게 지금 까지 먹은 쿠    넘 맛나요    분위기도 좋고 카페도 너무 예쁩니다    분위기가 따뜻하고 아늑해서 좋았습니다 재방문의사있어요 크리스마스 분위기가 물씬 나는 카페에요   회사 근처에 있어서 자주오는데 따듯한 분위기 좋아여    얼그레이 밀크티랑 피스타치오초콜렛 마셨어요  밀크티 풍미있고 고소해요       인테리어도 예뻐서 방문 추천합니다   매틀 그라니따 궁금해서 먹어봤는데 더위사냥 맛 나 는 커피 슬러시 같아요  친구는 디카페인 커피 시켰 는데 위에 크림이 있어서 카피랑 같이 먹으면     손님을 편안하게 해주는 친절한 카페  다시 찾고 싶은 장소이다  플랫화이트   생각보다 너무 작아서 선물주고 같이 열어봤는데 민망했어요  선물상자는 너무 예뻤습니당 카페가 예쁘고 분위기가 좋아요  메틀리카노 맛있어요   사장님이 친정하고 피스타치오크로플 짱맛있어요      그라니따는 시원하고 달콤해서 여름에 딱 잘 어울려 요  이번주까지만 판매하는 게 아쉬운 마음    피스타 치오라떼도 추천  진하게 향이 올라와서 넘 맛    맛있어요         벌써 연말 분위기 물씬 카페 이쁘고 메뉴도 맛있어요  크리스마스 분위기 가득    커피향이 가득   언니들과 함께 인테리어가 멋져서 들어온 카페예요  에스프레스 맛 있어요  배가 불러서 크로플을 못 먹어보는게 넘 아쉽 네요  비주얼이 엄청 탐스럽습니다  카페 내부    인테리어도 이쁘고 커피도 맛있고  디저트도 다양한 숨겨진 예쁜 합정 카페에요  카페 분위기가 좋고 아메리카노랑  케이크가 맛있어요   커피맛있어요 카페가 이쁘고 음료들이 개성이 있어요  그리고 인테 리어도 일반 카페들과 다르게 정감이 갑니다  음료가  맛있는것은 당연하구요  음료가 너무 귀여워요     눈으로 한번 먹고 맛도 있고 시그니쳐메뉴도 있고 너무 좋으네요       더운 여름 수박으로 몸 얼려요  맛있어요    분위가 좋아요   카페라떼도 고소하고   디저트 먹으러 오기 좋은곳    합정역 근처 오면 또 방뮨예정   역시 맛있어요  한정메뉴들  늘 기대를 져버리지 않는 감동의 맛    피스타치오 크림 맛있어요  커피도 고소한 거랑 산미 있는 거 고를 수 있어 좋았습니다  카페 메틀 분위기도 좋구 대화하기 좋아서 잘 놀다가 왔어요 시그니처 메틀 라떼 맛있어용    맛있어요    수박은 시원해서 더 좋아요  커피 맛있고 매장도 깔끔   너무 예뻐요    창가도 커서 답답하지 않고  너무 좋은 카페네요    직원분도 친절하시고 분위기도 좋고 디저트 커피도 맛있어요  연어샌디치 실패없는 선택 분위기 엄청 좋고 커피 맛집이에요  에스프레소도 맛 있어요 바노플 크로플 달달하고 바삭 촉촉해서 당충 전하기 딱이네요
