area,names,reviews
행궁동,콜링우드, 커피 너무 맛있어요 디저트도 좋네요    딸기 케 이크 크기가 커서 아깝지 않게 맛있게 먹었어요     카페가 첨에 좀 추웠는데 나중엔 직원분이     스타 필드 수원 팝업   으로 처음 먹어 봤어요  올해 먹었던 생딸기케이크 중 가장 맛있었어요  한 조각 케이크지만 역대급 맛있는 딸기가 풍성하게 가    딸기케이크는 딸기   프로 들어있는 듯    딸기 크기 도 엄청 크고 만족스럽게 먹었네요   여기 소금빵이 맛있다고 해서 먹을려고 했는데 금방 다 팔리    소금빵러스크  진짜   진짜 바삭하고 달달하니 존맛 탱 무조건 사먹어야함   딸기케익은 와우     딸기가 왕창 들어가있고 시트도 너무 축축하지 않고     진짜 매일 가고 싶은 곳이지만 특히 겨울 되면 딸기 케이크 먹으러 무조건 무조건 가야 되는 곳이에요            오랜만에 방문 했는데 역시     여기 디저트 찐맛집    최근 먹어본 딸기케이크 중에 제일 맛있구용    생크림소금빵이 레전드입 니당     아메리카노랑 먹어도 맛있을거같구용     수원사는 친구가 여기 딸기케이크를     꼭  먹어봐야 한다고 데려와줬는데        딸기 시트 크림 하나하나 정말 맛있어요   아 여기 커피도 대    딸기케이크가 제일 유명해서 주문했는데 맛있었어요 다만 웨이팅이 있는 편이고 요즘 카페처럼 메뉴들 전반적으로 가격대가 있어요 플랫 화이트와 딸기초코케이크를 먹었습니다   아 딸 기 초코케이크 아주 미 친놈이에요   진짜 맛있어요 홀케이크로 퍼 먹고 싶은거 참고 갑니다  매장     행궁동에 있는 카페중에 매장이 넓어요  좋아요 크리 스마스가 반겨주니 분위기도 나고요    특히 딸기 케익도   맛나고 디져트 종류가 맘에 듭니다      카페 넓어서 너무 좋아요   약간 어두운 느낌도 안락 해서 좋고 분위기도 즐겁게 대화하기 좋네요   트리 가 시선을 사로잡아요 리본장식 본적 드문데          대기  번 카운팅하며 기다린 콜링우드 카페 케익들이 다 맛있네요  그래도 디저트 가격대가 좀 많이 쎄긴해요 딸기케이크 매년 먹으러 오는 곳이에요  근데 이번엔 뭔가 더 단느낌이더라구요  글두 트리도 이쁘고 좋았어요 무슨 커피랑   다 만들어져있는 케익 기다리는데 삼십 분이나 걸린다네요 게살새우크림소금빵과 라떼 진짜 맛있어요 행궁동 장안문 근처에 위치한 디저트 커피 맛집이에 요  원래 콜링우드 휘낭시에 너무 좋아하는데 최근에 더 다양하고 새로운 디저트 구성으로 케이크     샤인머스켓 케이크도 너무너무 맛있어요  아메리카노도 라떼도 맛집이에요 소금빵도 맛집임   딸케최고 주 회 방문했네요 다음두 또 갈 예정  인기 많은 카페라 그런지 항상 만석인 거 같구   웨이팅 필수예욥 딸기케이크는   존이다    꼭 드시기    딸기케익이 맛있어요 애들이랑 디저트 즐기려 방문했는데 만족해요  너무 맛있어서 또 방문하고 싶어요  딸기케이크 맛집이에요   웨이팅 길고 카페 안에 화장실있는데 화장실도   분 기다려서 들어갔을 정도      딸케 최고예요     친구 추천으로 방문했슴다 친구가 엄청 좋아해요 복 숭아 철이 아니라 그런지 복숭아 케이크 맛은 그저 그 래요 망고빙수는 가격에 비해 너무 작지만        분위기도 좋고 디저트도 맛있어요                                                                                                                                                                           행궁동에서 마셔본 커피중 가장 맛있는 아메리카노를 마시고 왔어요  개인적으로 목넘김이 좋아서 맛있게 마시고 왔어요  주말이라 사람이 많아서 메뉴     시그니처 딸기케익과 라떼를 먹엇어요    딸기케익 딸기가 가득 들어있어서 넘 맛잇엇어용   같이 가신 분들도 여기 라떼 참 맛있다며 좋아하시더라구    평일낮시간대에 갔는데도 사람이 많아요   행궁동 메 인이랑은 떨어져있는데 메인쪽에는 사람있는 카페가 별로 없었는데 여기는 가득하네요   유명하다    너어무 맛있는 콜링우드 케이크  딸기케이크도 너무 맛있었는데 망고케이크도 꿀맛    망고자체도 달 달하고 좋아요  소금빵 종류도 많이 생겼는    올해도 딸기케이크 먹으러 갔어요  행리단길 맞은 편 북수동에 생긴 케이크 맛집  넓은 창고를 개조한 듯한 공간에 하얀 톤의 인테리어가 눈길이 감  빙수도 맛있음  역쉬 라떼 맛집   뭔가 달큰해요 망고케익 새로 나와 서 먹으러 왔는데 존맛탱    딸기케익과 비교하기 어 려울만큼 맛있어요   망고플롯맛 나서 넘나 제     매장이 진짜 넓구여 딸기케익 짱맛입니다  크림이 대박이에요 츄러스를 먹으러 간거였는데 쫀득한 식감에 반했어요 그리고 커피또한 산미가 적절해서 너무 맛있었습니다 매장이 크고 넓어서 좋았어요   노트북 작업하기도 좋을 것 같습니다 케이크나 커피는 보통 정도에요  케이쿠 맛있어욤 딸키캐이쿠 굿굿 케이크 맛있는데 너무 비싸요   리치히비스커스 맛있어용 딸기 케잌 맛집 커피도 맛나요 망고케이크 먹으러 왔는데 망고케이크 품절이라고 해서 멜론케이크를 시켰는데 진짜 먹어봤던 멜론중에 제일 맛있어서 아주 만족하고 갑니다   망고만 먹어도 넘 부드럽고 맛있었어요  케이크 겉 그 림이 약간 짭조름하고 따로 뿌려주는 크림은 약간 달 달했는데 같이 먹으니깐 단짠단짠해서 넘 맛있    가게가 넓적해요 대화하기에 좋아요 좋아욥 딸기케이크 맛집으로 유명한 행궁동 카페라는 건 알 고 방문했지만     정말 기대 이상으로 딸기케이크 맛 있었어요              시트  생크림  딸기 진    휘낭시에 없어유 츄러스 나오면서 안판대여     빙수 가 오지게 비싸지만 빙수 말고 다른걸 먹으면 되니까 유  담엔 다른거 먹게유 분위기는 넘 조아유 천    츄러스      원인데 진짜 맛있어요 커피도 맛있고 빵도 맛있고 또 가고 싶어요 분위기도 진짜 좋아요 보던대로 케잌에 후르츠가 야박하지않게 들어가네요 다른 케익들이 많이 빠져서 소금빵먹었는데 그런대로 괜찮았어요 행궁동에 위치한 모던한 인스타갬성 카페    좋어요 동물성생크림 딸기케이크를 제일 좋아해서 맛있다는 곳은 정말 다 먹어보는 중인데 콜링우드는 진짜 맛있 어요   케이크가 이렇게 압도적인 맛이면 커피    망고케익 비싸지만 맛있다 커피도 맛난편 루이보스차가 꽃향기가 나는 싱그러운맛 매장이 넓고 층고가 높아 시원하고 답답하지 않다 나쁘지 않다 오랜만에 크로플 먹으러 갔는데 이제 판매 안하신다 고 하시네요    제 최애 크로플집이었는데    너무 아쉽지만 골드키위케이크로 크로플 대신하고     리얼 다  맛있어요   망고빙수도 예술    생망고라 후루룩  아래에 크런치볼 같은것도 들어잇는데 조화가 최고  크림이    합니다 넘 달아서 호불호 갈릴 것 같아 용 저는 불호예요오       샷추가  천원임 짱비쌈 맛나요 분위기 미쳤다  카페 넓고 주인분도 친절해서 좋았어요  케익이 비싸긴하지만 맛은 있어요 저번에 먹고 너무 반해서 다시 또 방문 한 건데 역시 나 맛이 변하지 않았고 한결 같고 다른 딸기케이크를 먹어봤지만 여기만큼 딸기케이크를 못 따라 오    오랜만에 방문  항상 친절해요 디저트 메뉴가 많이 바 꼈더라구용 팥빙수 먹어봤는데 기대이하      음 팥 빙수말고 다른거 먹으러 재방문의사는 있어요    추천드리옵니다  딸기케이크 진짜 딸기 잔뜩 들어간 딸기케이크가 너무 먹고싶었기 때문에 대만 족이었습니다       중간 층이 빵이 없이 크림이      소금빵   이미 디저트 맛집으로 유명한 콜링우드  행궁동 대 기하면서 가야하는 카페로 유명하쥬   오랜만에 방문 했는데 인테이러가 더 유럽 감성으로 이뻐졌더    케이크가 먹고 싶을 때 꼭 들르는 곳  이날 망고 상태 는 조금 아쉬웠고  음료도 매장 상황에 비해 생각보다 너무 오래 걸리긴 했지만 그래도 명불허전이라    주말에 방문하니 사람이 많아서 시끌벅적했지만 콜링 우드의 커피와 크림모카를 잊지못해 다시왔습니다   그 유명하다던 딸기케이크를 이제서야 먹어봤      저번엔 딸기 이번에는 애플망고  애플망고도 맛있게 먹었어요 그래도 딸기를 못이기네욬     행궁동에서 재방문하는 얼마 안 되는 카페      딸기 케이크가 이제 안 나온대서 너무 슬펐어요        그래서 골드키위케이크 먹었는데 맛있긴     매장이 넓어요  사장님은 목소리만으로는 친절합니다  망고빙수 존맛탱  가격대는 좀 센편이지만 생애플망고빙수가 정말 맛있었음 딸기케이크 먹으러 한번더 방문할 의향 있음 오랜만에 갔는데 역시나 맛있는 디저트       포장해갈때 봉투에 한번 더 싸주셨으몀 좋겠어요  친한 언니 생파하려고 케이크가 맛있어보여서 왔는데 망고케이크 너무 맛있어요  찐망고가 그득그득 들 어있고 크림마저도 달달하고 부드러워서 너무     딸기케이크에 이어 망고케이크까지 너무 맛있어요  행궁동 케익 중 최고존엄   비엔나커피가 진짜 맛잇어요        꼭 드셔보시길  바랍니다   딸케 최고    친구들과 크로플 먹으러 갔는데 음료가 더 맛났던 곳  가족들 모시고 갔어용   매장도 커서 탁 트인게 너무 좋았구  음료    여긴 크림 맛집이네요  너무     케이크 비싸요   그럼에도 불구하고   커피 너무 맛있어서 재방문했 는데 기억해주시고 조용히 서비스까지    감사합 니다    아무리 배달 주문이 먼저 들어왔어도    아이스크림 크로플 맛이 생각나서 방문했는데 옛날과 맛이 많이 달라졌어용     아쉽지만 그래도 딸기 케이크가 맛있네요   음료도 맛있었어요  카페    인테리어 갤러리같이 너무 예쁘고 커피 맛있어용  딸기케잌 맛집이래서 방문했는데 한조각에     원   그래도 맛은 있었어요     바스크 치즈케익도 기대 했는데 크기차이 심하고 모양도   가성비         왜 콜링우드 딸켘이 유명한지 드디어 알겠어요    너무 맛있어요 시트 부드러운데 크림 딸기 달달구리 해서 커피 마시면 꿀조합이에요       넘     행궁동 소문난 맛집중 한 곳입니다  화이트 우드톤 인 테리어로 깔끔하고 특히 딸기케이크와 크로플이 맛있 는데요  인기가 실감나게 항상 빈자리가 없을     커피도 디저트도 다 맛있어요 소금빵  커피집인데 디저트가 정말 유명한 콜링우드      내부를 소형 갤러리처럼 여러 사진을 벽면에 전시해 놔서 텅 비어보이지 않더라구요  이곳에 오면     카페가 넓고 조용해서 대화하기 좋았어요 딸기케이크 먹으러 오랜만에 방문했는데 테이블 배치 가 바뀌었네요    앉을 자리가 더 많아졌어요  공 간이 넓어서 그런지 대화소리가 좀 울린다는     휘낭시에 맛있어용  콜드브루가 아메보다 맛있음  기억에 남는 포인트들이 많은 곳이였어요 일단 딸기 케이크 비주얼이 주문을 안할 수가 없었구요 커피가 크로우캐년 잔에 나와서 너무 예쁘고 맘에 들    딸케 조금 달지만 신선하고 맛있어요   매장이 넓고 예뻐요   천고가 높아서 그런지 엄청 울 려서 시끄럽긴한데 사진도 잘나오고 디저트랑 음료  다 맛있어요  배달로만 먹어봤는데 매장이 예    딸기케이크는 진짜    꼭 먹어야합니다   눈물나게 맛있음 커피 진짜 맛있어요  이 날은 라떼 마셨는데  콜링우 드는 플랫화이트가 진짜에요    따뜻한것도 시원한것 도 고소하고 비율 최고입니다   에그타르트도     주말 사람이 가득이라 대화할때 주변이 시끄럽다보니 대화집중도는 떨어짐 테이블 수 규모에 비해 화장실 남 여 한칸씩 있는데 여자화장실 줄서서 기다       행궁동 딸기케이크맛집 콜링우드  딸기시즌이 끝나기 전에 방문했어요  평일 오픈 시간이다 보니 매우 한 가하고 여유롭습니다  맛이 없을 수 없은 조합    커피도 맛있지만 디저트 말해뭐해요 정말 맛있어용 맛있어요  수원에서 손꼽는 딸기케이크 맛집  딸기 양이 엄청많 아요 달달하고 크림과 잘어울리는 케이크 입니다 커 피도 무난하고 사장님  직원분들이 친절해서     칭구가 생일케이크 사줬어요  망고가 이렇게나 그득그득하다니      시트도 넘 맛있고  역시 장수 카페는 다릅니다  울 강쥐랑 카페뫘어요 구름이 빡침 엄마가 멍푸치노  사준다했는데 없어 못먹었어   망고케익에 망고가  듬뿍 커피도 맛있네요  크림 초코 위에 있는 크림 정말 맛있어요   케익 위에 올라가는 크림과 비슷한데 케익 위에올라간 크림보  덜 달아요    좋아요 디저트도 맛있고 분위기도 좋아요  딸기케이크랑 휘낭시에 완전 맛집입니다   아디다스 반팔입고 주 문 받아주신 남자알바생분은 들어올때부터 인    커피 산미 없어서 맛나요  케이크들도 우유크림맛이라서 존맛탱    추천 커피는 맛있고 츄러스 처음먹었는데 쫀득하고 맛있어요 기대했던 아늑하고 따뜻한 분위기는 아니었지만 문전 성시를 이루네요 생각보다 커피도 맛나고 무엇보다 왜 테이블마다 딸기케이크있는지 알겠더라구    디저트 맛집  딸기케이크 다음을 이을 초코케이크의 등장이네요  에그타르트 말해 뭐해 촉촉 그자체입 니다  사람이 많고 북적여 책 읽기나 노트북을     굿 너무 좋았어요 또 올 예정이에요 창고  카페로 굉장히 넓고 테이블 간 간격도 커서 대 화하기 좋습니다  다만 규모에 비해 온풍이 제대로 안 되서 커피가 빨리 식고 추웠어요  담요가 없어    디져트 맛집이라 해서 왔는데 딸기케이크  소금빵    진짜 맛있게 먹고 갑니다   디져트 인생맛집을 찾 은 것 같아요     직원분들도 친절하시고     친절하고 디저트가 맛나요 맛있어요  이제 딸기철이 지나갔는데도 딸기도 맛있었어요  매장 넓고 깨끗해요  혼커피 하러 간거라 벽쪽    인 석에 앉았는데 좀 추워서 담요 사용했어용  딸기케 이크 하나 보고 간건데 미션 클리어   꼭 드셔보    살면서 먹어본 케익 중 제일 맛있음   딸기를 진짜 좋아하는 사람인데  한입먹고 감동 그자체였어요  너 무 달지않은 생크림과 부드러운 시트와 딸기의   
