area,titles,reviews
교대역,서초커피작업실, 연습실 두번째 방문했습니다     커피가루로 라떼아 트 연습하는거 보시고 이번에는 라떼아트 연습용 파 우더랑 스팀피처 여러개 꺼내주신 덕분에 신나    일년정도 된 단골입니다  저는 주로 오늘의 커피를 즐겨 마시는데 매일 다른 원두로 내려주시고 커피에 대해 질문하면 섬세한 맛의 디테일까지 자세하         바리스타  급 시험 앞두고 라떼아트가 늘지를 않아서 연습하러 왔어요   학원에서 쓰던 것과 기구들 이 달라서 엄청 헤매다가 뒤늦게 적응하고 열    실력이 늘기위해선 연습이 답인거같아서 예약하고   시간동안 이용했어요   생각했던것보다 큰공간은 아 니였지만 혼자 집중하기에 딱입니다    예약때    아기자기한 동네카페 가격 저렴하고 테이크아웃잔이 독특하다 말차샷 달콤쌉쌀 맛있어요   뚜껑 닫고 마시기엔 아까운   작지만 소중한 카페랍니다  오늘도 진  하고 향기롭게 커피 한 잔하고 하루를 시작  항상 맛있어요  커피가 맛있고 컵 모양이 유니크해요 항상 너무 맛있어요    아기자기 다양한 메뉴가 있는 귀여운 카페   아는 사람은 다 아는 핫플레이스       매달   일은     할인해줍니다    친환경을 생각한 컵 패키지가 특이했어용  할머니미숫가루강추에요 메뉴가 특이한게 많아용 바쁜 아침에 네이버로 주문하고 받아가면 좋아요  사들고 오는데 컵 이쁘다고 그러네요 커피맛도 좋아요 너무 맛있는 커피  여기 커피 마시다보면 다른 까페  커피는 못먹어요 가격도 저렴하고 커피도 맛있고 사 장님도 친절해요    귀여운 장난감과 맛있는 미숫가루 커피가 진하고 맛있어요  미숫가루랑 블루베리요거트스무디를 시켰는데 둘다 너무 맛있었어요   매장 내에서 마실 수는 없는 것 같 았어요  어차피 전 집가서 마실 예정이었어서     저번에 커피가 너무 연하고 맛이없었는데  오늘 커피 사봤는데  어  오늘 완전 맛있네요  커피 맛집이에요   맛나용 테이크 아웃해서 산책하기 좋아요     실기 시험 대비로 연습실 찾다가 딱이여 예약했는데 가게 사장님께서 너무 너무 친절하시고 안내도 잘해주셔서 만족합니다   커피맛이 다채롭다고 느껴졌어요 산책하면서 마시는 커피 굿굿 매번 앞을 지나가다가 처음 아아를 접했는데 우선 재활용 종이컵이 특이했는데 빨대는 풀라스틱  커피맛은 무난하게 적당히 무겁고 구수합니다  독특하고 맛있어요 실수로 핫 시켰는데 전화로 아이 스 확인해주시는 친절함   감동입니다 담에도 주문할 게요  이곳 가시는 분들은 점심시간 밀려서 미    스티밍이랑 라떼아트가 잘 안되서 클래스 신청했는데 너무 친절하게 알려주셨어요  첫번째 사진이         두번째 사진이       입니다   너무 만족해용   강아지와 산책하며 커피를 즐기기 너무 좋은 카페   사장님께서 반짝반짝 빛이 나는 밝은 미소로 친절히 안내를 해주시며 서비스가 좋습니다  뜨아를     커피연습하러갔어요 두시간동안 집중해사 할수있어서 넘 좋았어요 담엔 리떼아트 배우러가랴고요  약간 좁지만 바리스타 연습하기에 나쁘지 않은 공간이었고  사장님은 마감 정리가 제대로 되지 않았음에도 이해해 주시고 친절하셨습니다  감사니다  너무 맛있어요 조금만 더 진해도 좋을 거 같은데 그래 도 좋아요 인기있는 커피집이라 네이버예약주문하고  가는 거 추천해요 커피도 맛있고 환경 생각하는 컵이라 더 좋은 거 같아요  며칠 전부터 서커작 커피가 계속 먹고 싶었는데 시간이 안 맞아서 못 먹다가 오늘 드디어  마셨는데 너무너무 맛있어요  최고  컵이 예뻐서 커피 맛이 더 좋은 느낌이 들어요  양재역에서 좀 멀지만 산책삼아 다녀오기 좋은 거리에 있어요  서커작에서 디카페인은 처음 시켜 보는데 역시 너무 맛있었어요  산미도 적당하고 맛도 찐하고 맛있었습니다    주변 카페 중에 커피맛이 제일 좋아용    진짜 맛있는 커피 찾는분이시라면 여기입니당  좋은 원두의 커피를 좋은 가격에 마실 수 있는 가성비      커피집입니다  테이크아웃만 가능하고  기다 리는 시간 지루하지 않게 아기자기한 소품이     꺄 산책하다가 커피 맛집 찾아서 기뻐요 친절하신 사 장님 연속으로 방문 해요   리뷰쓰면 비누도 주시더 라구요            잘쓸게요 벌써  번째 방문입니다  커피가 너무 맛있어서 멀리서도 오게 되요  커피가 깔끔하게 맛있고 계속 생각나요  나만 알고싶어요   손님 자꾸 늘어나지마요       오후에 항긋하고 달콤한 커피가 힐링이에요 서초커피 작업실 아기자기한 인테리어로 비대면 주문으로 친환 경 포장재료들 참 칭찬해요    브루잉커피 미    오늘의 커피 너무너무 맛있어요 늘 어떤 원두인지 설명도 친절하게 해주셔서 좋아요  서커작 초코라떼는 사랑그자체예요  직접 만드신 초코시럽과 깔끔한 우유맛 오레오 토핑까지 온가족이 탐내는 음료예요   귀여븐커피집 할로윈 분위기 가득한 곳이에요    공간활용이 너 무 좋고 리뷰를 꼼꼼히 보고 갔어야 했는데 테이크아 웃 커피전인지 몰랐던 거예요  중요한 만남    서커작  여기 단골들은 다 이렇게 부른답니다 우리 동 네 최애카페  쿠키와 출근길의 배고픔을 달랬는데 오늘은 핫한 머그잔에 먹고파 머그잔으로 요청    서초 아메리카노 찐 맛집  처음 접하는 거라 수업을 잘 따라가지 못할까 걱정했 는데  이해하기 쉽게 핵심 설명을 잘 해주셔서 단시간 족집게 과외를 받은 느낌입니다  같은 원두로     맛이 다크하지 않고 산미가 있어 좋아요 카페리뷰 잘 안써요 네이버 리뷰 광고만 많은거 같아 서요 그런데 서초커피작업실에서 커피 마셔보곤 감동 에 감동    카페라떼매니아라 서울에서 안사먹    친절하고 환경을 생각하는 작고 아담하지만 멋진 카페입니다  덕분에 힐링했습니다 감사합니다    쪼그마한 이쁜 커피숍이 동네에 생겼네요 깨끗하고 부드러운 커피 한잔으로 시작하는 가을 아침    귣 이제까지 마신 커피는 다 잊어라 차원이 다른     복아샷추  맛있어요  컵 예쁘쥬  컵 예뻐서 물어서 찾아갔는데 너무 맛있어 요  다른 메뉴들도 맛있구여 복아샷추랑 그랏세   친 절하고 갱어지 스티커도 있고  메뉴판도 핸드    바닐라빈라떼 정말 맛있었어요 다른 데랑 비교가 안 되네요 시럽이 달기만 한 게 아니라 고소해요    그 리구   일 그린데이  이벤트라고 해서 반값에                                           음료랑 커피가 맛있고 정말 친절하세요   바리스타 수 업도 있고 진짜 전문가의 포스가 느껴지네요    주 차도 가능하다는 큰 장점도 있어요   단골될 듯    커피가 맛있어요 전문적으로 디테일하게 준비해주시기에 주문이 많아지면 조금 느리게 나오지만 커피 맛이 좋아요 눈이 펑펑 내리는 날 넘 추워 좋아하는 카페 들러 레 몬생강차 한잔 마셨어요 커피만 맛난줄 알았더니 다 른 메뉴도 다 맛나네요 친절함에 항상 방문할    오픈 때부터 너무 좋아하는 서커작   제 최애 메뉴인 바닐라라떼 먹었는데 다른곳 아바라는 이제 씅에 안 차지 뭐에요     사실 서커작에 최애가 너무     매장 너무 귀엽다고 생각했는데 카페 강쥐들 콩이  나 물이 돌아방스       사장님 친절하시고 커피도 너무 맛있어요   알고보니 사장님이 커피쪽으    동네 커피 맛집이네요   맛있게 잘 마셨습니다  친구가 바닐라빈라떼 먹어보더니 너무 맛있다고 앞으로 다른 곳에서는 못 마실 것 같다고 했어요     더 자주 가게 될 것 같네요   즐겨찾는 카페에요  커피가 맛있는 커피전문점이에요  바리스타를 가르치시는 분께서 직접 운영하셔서 커피 원두부터 남달라요 향과 풍미가 좋아요    라떼에 무슨 마법을 부리셨나요     진짜 인생라떼 여기서 만났네요 어제도  시간 걸려 커피먹으러갔 다 명성에 비해 실망이 더 컸는데 우연히 발견    한달에 한번씩 크게 할인하는 카페라 회사근처라 종종 한잔씩마심  아이스카페라떼 맛있다  인스타갬성 커피피잔도 좋소 요즘 카페가 많아도 너  무 많지요   그런데 가격과 맛  커피의 진정성까지 느끼고 싶다면 서 커 작 커피 한번 드셔보세요     공간은 작아도 커피를 드실    커피공부를 하기 위해 바리스타 연습실 대여를 해보 았는데요 먼저 대여하는 사람들에게 제공해주는 커피 를 마셔보았는데 너무 맛있었습니다 손수 만드    선생님께서 잘지도해주시고 커피도맛나용         만 가능한 커피맛집 텀블러 중고생할인도 있어요 서커작에서 매일 아메리카노만 마시다가 사장님이 추 천해준 크림오레그랏세 마셔봤는데 진짜 너무 맛있어 요  메뉴컨설팅도 많이 해주신다고 하더니 다    커피 맛있어용     원 아인슈페너입니다  사이즈도 맛도 정성이시네요        감동입니다 여기 바닐라라떼를 제일 젛아해서 항상 바닐라라떼만 마시다가 오늘 처음으로 딸기청라떼도 마셔봤는데 이것도 엄청 맛있어요     원래도 자주    굿 분위기 넘 예쁘고 음료 다 맛있어요   서커작은 커피도 너무 최고지만 칵테일도 최고     청량달달하니 여름에 딱이에요  인생 라떼를 만난곳입니다  근데 영업시간 좀 업데이트 수정해주세요  말렌카 진짜 좋아하는데 서커작에 생겨서 너무 행복해요   디저트도 커피도 최고입니다    뱅쇼   짱      이제는 집 오기 전에 꼭 들르는 곳이 된 서커작   나 물이는 그래도 자주 봤는데 오늘 콩이 가까이서 처음 봤는데 콩이도 너무 귀여워요    서커작 쿠키는     요즘 최애카페예요      다른카페에서도 바닐라만먹는데 수제바닐라라떼 너무맛있네요 인위적인맛 아니라서 넘좋아요   근처에 오늘의 커피를 하는곳이 없는데 올때 마다 다양한 드립커피를 마실 수 있어 좋아요   아메리카노가 좀 싱겁네요 굿 카페에 상주하는 강아지들이 순딩순딩 너무 귀엽고  똑똑하네요  음료도 너무 맛있고 저렴해요  커피 진짜 맛있어요  팥빙수도 맛있고 좋아요  어제 처음 방문했는데 사장님도 친절하시고 커피가  너무 너무 맛있어서 오늘 또 들렀어요  친환경 컵도  좋고 메뉴도 다양하고 맛있어서 자주 갈 것 같    식후엔 역시 커피가 최고져   매번 주문할때마다 고민 을 엄청 하는데 오늘은 수제 바닐라빈 라떼를   한 모 금 마시자마자 감동을 받았습니다    모든     쉬는날을 제외하고 매일같이 마시는 커피에요   커 피에 대해서 잘 모르지만   커피의 산미 사이에서 느 껴지는 달콤하고 부드러운 향이라고 해야하는    딸기패션후르츠티 새콤달달한 게 딱 여름 맛이에요  자꾸자꾸 생각나는 맛  커피도 늘 맛있습니다    회사근처 산책하다가 우연히 알게 된 곳인데 오늘의 커피 스페셜티 드립커피  너무 맛있습니다  주인분도 친절하시고요  아기자기 귀여운 곳입니다  언    놀러온 친구가 딸기패션후르츠티 너무 맛있다고 아껴 마셨어요     전메뉴가 맛있는 서커작 최고   조용해서 집중하기 좋고 짧은 시간에 많이 연습 가능해서 좋아요  매일같이 먹어도 너무 맛있어요 서커작 최고   종이 포장이 환경을 생각한것 같아서 너무 좋고  강아지들은 귀엽구 주인분이 너무 친절하세요      근처 갈일이 있어서 주차 커피 겸 급하게 문의드렸는 데 너무 친절하게 설명해주셨어요   바닐라빈라떼도 맛있고 편하게 있다가 갑니다  동네주민 분들    우연히 카페를 보게되어서 와보았는데 너무 맛있기도 했고 강아지인 콩이와 나물이도 있어서 엄청난 당골 이 되었어요    음료도 맛있고 알바생분과 사장    커피 맛있고 친환경패키지 좋아요  강아지도 너무 귀여워요  커피가 너무 맛있어요  한 입 마시자마자 바로 단골등 록   특히 저는 아인슈패너 중독자라서 많이 찾아 마시는데 여기 아인슈패너는 정말로 크림과 커    빠르고 싸고 맛있어요 리브레원두 커피 넘 맛나요 예약시간도 못맞추고 정신없었는데  친절하게 해 주셨어요  감사합니다  일반적으로 카페에서 보는 플라스틱 컵은 아니어서 생소했지만 환경을 생각하여 사용되는 컵이 인상적이었어요  커피도 맛있었습니다    아인슈페너 맛있어요   오다가다 많이 사먹을거같습니다 커피는 아주 저렴한데  재활용 컵홀더가 불편해요 이쁜 콩이랑 나물이 보러 자주 와야겠어요     지구를 살리는 맛있는 커피  조아요 조아요
