area,names,reviews
부산 서면역,원스어시너리, 케이크가 진짜 맛있었어요      타르트도 엄청 맛있 어 보였는데 가격이 조금 있길래 케이크 한조각만 시 켜서 먹어봤는데 다음번에 간다면 타르트도 먹    낮에 왔으면 더 좋았을 카페   여기저기 돌아다니다가 다 웨이팅있고 사람들에 치이 다가 들어온 곳이에요 우연히 들어왔는데 분위기 트 리도 너무 예쁘고 케익 커피도 너무 맛있어서     맛있어요  매장이 넓지않지만 예쁘고 디저트가 특히 맛있네요    층에 위치한 카페지만 편안하고  음악선곡도 굿   친구랑    같이 수다 떨기도 편하고   디저트도 맛있 어용     후르츠케잌    항상 간판 볼때마다 궁금했던 카페    친절하고 맛있어요   라떼 아트가 너무 이뻐요  딸기케이크도 맛있었어요   예전부터 너무 오고 싶었는데 드디어 와봤습니다  디 저트 맛있다고해서 왔는데 마감 시간  시간 전에 와 서 그런가 많이 없더라구요    지인한테 메    전포동 거리를 지인들과 돌아다니다가 입구 앞에 세 워진 작은 입간판에 이끌려서 들어가본 카페입니다  향긋한 쿠스미 블렌드 홍차와 이쁘고 맛있는     전체적으로 분위기도 좋았고 창문이 크게있어서 개 방감이 들어서 좋았어요 케이크도 안느끼하구 디게  맛있었어요   카페 분위기도 아늑하고 커피와 디저트도 맛있게 잘 먹었습니다   비오는날 방문하였는데 너무 좋았습니다 평소에도 케 이크가 너무맛나서 자주왔었는데 비도오고 그래서 따 뜻한차를 마시고 싶은데 못고르고 고민하고있    사장님도 넘 친절하시고 혼자 카페 즐기기 좋은 분위 기였습니다   노래 선곡도 카페 분위기와 알맞구 커피 도 깔끔하니 맛있었어요  케이크는 제철 과일    분위기 좋고 친절해요  딸기케이크 맛집 차분한 분위기네 인테리어가 취저였어요  디저트도 다양하고 티도 다양하게 즐길 수 있어 좋았습니다   바닐라빈라떼 당도 적당하고 맛있어요 딸기케이크가 진짜맛있습니다따봉  케이크도 맛있고  뷰도 좋고  사장님도 친절하시구  커피맛도 맛있고 케이크랑 아이스크림도 맛있었어요  친구랑 대화하기도 편하고 좋은기억 가지고갑니다    머리끈이 없었는데 직원분께서 머리끈을 갖다주셔서 감동  번창하세요  맛있어서 또왔어요  창가자리가 너무 매력적인 카페 입니다 혼카를 즐겨서 바 자리나  인 자리를 즐기는 데 창가 바 자리가 통창으로 밖구경하기도좋고    밤에 커피를 마시기는 부담스러웠는데 향기가 좋은 구스미티가 보여서 마셔보았다  달콤한 케잌과 과 일향 꽃향 가득한 차가 있는 휴식 좋다 특별    케이크가 너무너무 맛있어요    곧 또 방문할게요  음료 케익 전부 맛있고 직원분들도 아주 친절하세요  분위기도 좋고 편하게 잘 놀다 갑니다 머스크 멜론 케익 정말 뷰들뷰들 맛나네요 강추합니다 멜론케이크 넘 맛있어요      시트가 엄청 부드럽고 많이 달지 않아 좋네요  인테리어도 요즘 유행하는 그런 느낌   갬성 넘쳐요 후르츠케이크가 부드럽고 맛있어서 계속 손이 갔어요  티 종류도 많은데 향을 맡고 선택할 수 있어서 좋았어요   카페도 예쁘구 케이크 존맛이에요    포장비용    원 있어요   케이크 개 존맛탱구리 진짜맛있어요 매장 분위기도 좋아요 또오고싶어요 사장님도 완전 친절해요    오늘 처음 원스어시너리 카페 와 봤는데 공간이 참 아 늑하고 포근한 느낌이 많이 드는 거 같아요  아기자 기한 소품들도 있고 멜론 케이크 안의 멜론이     우연히 들어갔는데 취향저격  커피도 맛있고 특히 케이크 정말 맛있었어요  공간도 아늑하고 따뜻한 분위기라 편안했구요  사진 속 케이크      맛있어요  사장님이      친절하셔요  첨에는 아무도없었는데 나중되니 만석이 되었어요  여기 먹고싶어서  번째 방문했는데  비오는날에도 불 구 하고 자리가 만석이라 다른카페 갔다가  시간 뒤 에 다시 방문했어요     케이크 진짜 너무     수다떨기 좋은 프랑스풍의 아담하고 이쁜 공간  커피 크레마 진하게 남고 향도 풍부하다  에이드  차도 다 괜찮다  케이크도 먹어보고 싶다  인테리어 분위기가 따뜻한 느낌이라 좋아요   케이 크 부드럽고 많이 달지 않아 좋고 음료 커피도 너무 만족스러워요    다음엔 메론케이크도 먹어    케익 찐으로 맛있음     메론케이크는 다른 카페에서 본 적이 없는데 디저트  메뉴가 이색적이라 좋았어요  내부 인테리어도 취향 이었고  창가자리도 바깥풍경 보며 혼커하기     친절하시고 케이크 크림과 시트 멜론 다 맛있어서 다음 생과일 케이크가 기대되는 맛이에요 혼자 방문하기도 좋았구 즐거웠습니다 우연히 가게되었는데 케이크 너무 맛있어요   사장님이 맛있고 커피가 귀여워요   신상이라해서 호다닥 다녀왔어요     인테리어 너무 이쁘구 조용하게 대화하고 쉬다오기 좋았어욤     납작복숭아에이드 너무 맛잇어요 추천함미다  친구 추천으로 처음 방문한 곳이었는데 만족하고 갑 니다  카페 인테리어도 잘 되어있고 너무 친절하셔서 좋았어요  음료와 디저트도 정말 맛있게 잘 먹    전포에 신상카페 생겼다해서 다녀왔어요  제가 갔을 땐 만석이라 조금 시끄럽더라고요    커피 맛있었 구   분위기는 좋았어요  무엇보다 직원분들이    조용하고 예쁜 신상카페  케이크에 메론도 가득 들어있고 맛있어요 신상카페길래 잠시 들렀는데 너무 만족했어요  분위 기가 너무 편안해서 대화하기 좋을 것 같아요  전 혼 자 갔는데 요즘 힙하기만 한 카페처럼 갔다가     음료도 맛있고 정말 친절하세요     하필 비오 는 날 투명우산을 잃어버렸는데 말씀드리니 사장님께 서 본인 우산을 주셨어요     정말 감사합니다 혼자 있어도  친구와 같이 있어도 좋을 곳이었어요  저는 혼자 갔는데 맛있는 디저트와 창가 앞에서 시간 가는 줄 몰랐네요    비가 와서인지 카페에 사람이 많아서인지 내부가 그 리 넓지 않아서 카페 분위기를 온전히 즐기지 못한 점 이 아쉬워요       케이크 맛집이라던데 케이크    분위기 좋고 맛있었어요  케이크도 너무 맛있고 음료들도 진짜 맛있어요 디저 트 맛집입니다      다 먹고 포장할려고 했는데 제 가 제일 맛있게 먹었던 케이크들은 다 품절이    차는 맛도 향도 좋아요 멜론케이크는 쏘쏘 케이크꼭드세요    촉촉하고 부드러워요   굉장히 친절하시고 케잌이 맛있었어요  맛을 잘 살린  느낌   음료도 맛있었어요   커피도 디저트돠 잘 어 울렸고 디카페인이 있습니다   차도 좋았어요  메론케이크 너무너무 맛있어요     아늑하니 분위기도 좋아요  메론케익 필수 커피가 진하고 디저트가 맛있습니다 맛있게 잘 먹다가 갑니다    커피도 케이크도 맛있었구 매장도 너무 예뻐요   너무 친절했어요 당근 케이크와 자두살구에이드 맛있게 잘 먹었어요 전포동에 이쁘고 어담하고 깔끔한 카페가 최근에 오 픈했네요 인테리어 가구와 소품 모두 진심으로 꾸며 놓았고 음료와 특히 빵은 넘 맛있었어요 사장    디저트도 음료도 맛있었어요 에어컨 너무 빵빵하게 트심 추워서 나옴 디저트는 맛있는데 싸이즈가 작네요 카페 내부공간이 넘 취향저격 이에요     주문한 케이크  라떼도 넘 맛있어요  창가자리가 아마도 포토존   트리너무이뿜     커피맛집   맛있게 잘 먹었습니다  친구가 맛있다고 해서 케이크랑 에이드 먹었는데 넘 맛있었습니다 다음에 또 갈 예정    케익도 맛있고 커피도 맛있었어요  층뷰가 시원해서 좋았습니다 굿 좋아요 커피맛집   맛있어요 분위기 너무 좋아요    에이드  케이크 전부 다 맛있어요    메론케이크가 맛있다고 해서 들렸는데 가을철이라 없 드라구요   직원분에게 물어보니 메론케이크의 시트 와 생크림이 똑같이 들어간 후르츠 케이크를    
부산 서면역,이너프 커피, 새해부터 주말엔     부터 영업한다고 해서 방문 한 곳    조용히 이너프분위기를 즐기고 싶어서 일부러 아침에 방문했는데 역시나 조용하고 좋았다      분위기가 너무 좋아요  리뷰도 정말 많아서 전포동 맛 집으로 넘 적합해요   음식들도 맛잇도 음료도 훌륭합 니다   직원분들도 친절하시고 맛있는 곳 좋은     요근래 카페에서 먹은 빵   류 중에 진짜  티어         전포 근처 돌아다니다가 지쳐서 대충 자리 있 는 카페 그냥 들어갔는데 들어서자마자 맛있는    역시 이너프    못잃어     이너프 체리탁틴새우탁틴 은 초기때부터 좋아하던건데   새우탁틴 여전히 해 줘서 고맙구요   오랜만에 먹었더니 맛이 더 풍    다 맛있어요 또 가고 싶은 곳이에요 그릭요거트도 샌드위치도 너무너무 맛있고 인테리어  분위기 뭐 하나 빠짐없이 맘에 들었던 전포 브런치 카페였어요   앞으로 전포 브런치카페 찾으면    가게는 좁지만 새우탁틴 존맛탱  가격은 저렴하지 않지만 맛있으니까 용서가능   또 생각나는 맛 예뻐요 테라스에 앉기좋은 날씨 집에서 요거트에 말아먹으려고 샀어요  담백하고 고소해요    여기 진짜 커피도 푸드도 다 맛있는데  커피 텍아웃 했더니 할인이되요  야무지게 할인 받고 음료 텍아웃 잘 했어요  최고   커피가 맛있어요  서면 최고의 브런치 카페  분위기가 정말 좋아요  에그 올라간 번은 꼭 시키셔야해요  짱맛   롱블랙도 적당한 산미라 맛있었구  그래놀라볼도 재료가 신선해서 좋았어요  커피가 좋았어요 우연히 지나다 끌리듯 들어갔는데  분위기 맛 모두  너무 마음에 들었어요 알고보니  년이 되었다고     그렇게 오래 버틸 수 있는 힘이 있는 카페 였습니다  커피도 맛있고 브런치하기 좋은카페예요 하하하하하핳 롱블랙이랑 새우탁틴 말모    진짜                           아이스롱블랙이랑 새우탁틴은    사과당근 쥬스도 맛있구요      얼음의 롱블랙도 좋아요  비주얼 훌륭하고 맛있음   돌담 앞에서 인증샷 필쓔   예뻐서 먹기 아까웟지만 존맛탱이라 순삭해보림  비오는 날 야외테라스에 앉아 있으니 시원하고 좋네요    롱블랙은 살짝 산미가 있는것같고 추천해주신 블라썸 음료는 더운날에 먹기 아주 좋은음료였어요  샥슈카 는 살짝 매콤함이있답니다    매장은 생각보다     드디어 가본 이너프 비알이티번이 미쳤구  샥슈카는 좀   빵도 별로였고  다음엔 비알이티랑 샌뒤치 먹으러 가야겠어요    맛있어요 담엔 매장이용 해보고파요  비알이티번  이거 진짜 대 존맛탱 모든 재료와 소스의 조합이 먹을때마다 맛있다를 연발하게 만들었 어요  든든함은 당연히    샥슈카  자극적이    카페인 수혈 지대로였습니다 언제가도 맛있는 이너프   메뉴가 조금씩 바껴서 새 로운 음식을 먹어봤는데 역시 맛있습니다     또 갈거 에요 사장님이 친절하게 환대해주셔서 너무 기분이 좋아요     맛도 분위기도 굿굿 만족 두배  샥슈카 번 샌드위치 셋다 넘 맛있었음  샥슈카는 짜지 않고 간이 딱 최고 번이랑 샌드위치는 뭔가 각각 특 별한 소스가 넘 맛있었음  롱블랙은 넘 맛있었    날파리가 많아요     음료는 상큼하이 맛잇어요  매번 롱블랙만 먹다가 바닐라라떼는 처음 먹어봤는데 맛있어요   가게는 협소하지만 내부에 천장이 높아서 그렇게 작 아보이진 않음  인 테이블  개   인 테이블  개  야외 테이블  개 메뉴는 무조건  인  개 음료는 해야    분위기도 좋고 맛도 좋고 사장님도 너무 친절해서 좋은 곳   인테리어도 아기자기하게 잘 되있고 토스티는 정말 신경써서 만드는 그런 느낌  맛있고 카페 분위기도 좋아요   롱블랙 너무 맛있어요  그리고 카페 분위기도 좋구 사장님이 친철하십니당   롱블랙 플랫화이트 치킨토스티 이렇게 주문했어요    시  분쯤 가서 자리없을까봐 걱정했는데 다행히 오 늘은 널널했네요   커피는 산미있는 맛이었고    갈때마다 기분좋은 곳  커피도 맛있고 친절해요    이번엔 안먹었지만 브런치도 짱맛    커피가    좋어요 인스타 갬성이구 좋긴한데 매장이 협소하고 화장실이 불편해서 오래 머무르기는 힘들 것 같아요   전리 단길에서 나름 오래된 카페인듯  그런데 와이    아늑하고 편안한 분위기의 인테리어에  직원분들께서 도 친절하세요  커피가 유명하다고 들었는데 정말 맛 있었어요  특히 콜드브루가 눈이 번쩍 떠지는     테이크아웃할인되서 좋아요  이렇게 맛있고 진한 커피는 정말 오래간만입니다  자꾸 생각나는 맛  브런치 기대하고 갔는데 사장님도 친절하시고 생각지도 않았던 커피가 너무 맛있었어요   물론 번도 맛있었습니다   맛있고 분위기가 좋아요 커피는 쏘쏘했고 티는 맛있었어요 새우탁틴이 메뉴에서 빠진다는 소식을 듣고 오랜만에 왔네요    최애메뉴인데 너무 아쉬워요 그래도 맛있었다     롱블랙 넘 맛어요 진해서 음식이랑 같이 먹으니 딱 느 끼함 잡아주는 깔끔한 맛이라 좋았어용 라떼도 고소 하고 맛있었고 무엇보다 친절하셔서 좋았어요   공간이 좁아 시끌시끌     롱블랙 커피가 완전 맛있어요  롱블랙 맛있어요   전포대장 조용히 몇년째 제일 사랑하는 카페입니다   맛있어요   브런치로 유명한 곳인데 점심 먹은지 얼마 지나지 않 아 롱블랙과 스위트어텀 먹었습니다  좋은 원두에 커 피도 잘 내려서인지 맛있게 잘 먹었습니다  아    요리 냄새가 너무 나서 옷에 베요   브런치가 너무 맛있었어요 생각없었는데 냄새 맡고 바로 시켰어요 커피와 에그타르트도 맛있었지만  조용히 대화를 나눌수있는 공간이어서 더 괜찮았어요   정말 궁금했던 곳이었는데 기대만큼 좋았어요 높은  천장 미국같은 인테리어랑 분위기 게다가 직원분이  너 무 친절하셔서 기분좋게 잘 있다 왔습니다      커피가 산미가 있는편이라 산미를 불호하시는분은 비추   흑흑 맛있어요 친절하고 맛있어요 너무 맛있어요   두세번 가고 싶은 감성카페  사장님도 친절하시고 에그타르트 그냥 먹으삼 커피랑 에그타르트 너무 맛있어요   식사류를 못먹어서 그런지 커피는 쏘쏘 얼음이 크게 들어간 시그니처 커피는 신기했음 갈 때마다 기분 좋은곳      인테리어 깔끔해요  화장실은 공용이라 조금 불편해요    마싯어용 넘쥬아요오 분위기 좋아요 야외 테라스 굿 커피도 맛있고 그래놀라 샌드위치 다 양도 푸짐하고 맛있어요  또 친절해서 또 방문하고싶어요 좋아요 좋아요     왕친절하시고 커피 맛있어요  롱블랙 넘 맛있어요    플화도 진짜 맛있구       분위기 좋아요 굿 적당한 산미가 있어 맛있지만 양이 아쉬운 아이스롱블랙   커피 맛이 좋아요 브런치 너무 맛있는 곳  그래놀라는 그냥 그랬어요   협소한 공간에 테이블 간격도 가까운데  테이블이 연 사 연속사진 찍거나  지속적으로 사진을 찍어서 커피 만 얼른 마시고 카페  차하러 옮겼어요  좁은     오랫만에 들렸는데 바쁘신데도 알아봐주시고 반갑게 맞아주셔서 행복했어요  바닐라라떼가 저에겐 너무 맛있어요 저희 신랑도 커피 마시자니 암말않    좋아요 새우탁틴 계속 생각나요 훌륭훌륭훌륭 최고에요 커피 넘 맹맹하규 맛 없었어요 쵝오 좋아요 좋아요 새우탁틴 맛있어요 플렛화이트 굿굿 라떼도 굿 쿠키도 맛나요 테이블도 생각보다 많이있고 커피도 맛나요 분위기도 좋고 친절한 직원분들에 기분도 좋네요 다만 샥슈카 에도 새우나 재료들이 좀더 들어가있음 좋겟어요   맛잇어요 모든 메뉴 다맛있고 웨이팅있어요 좋아요 새우탁틴 존맛탱 맛있는 요거트와 롱블랙아메리카노  짱입니당  산미있는커피  인테리어이뻐요 좋아요 좋아요 친절한 서비스 받으러 간건 아닌데 불친절한 서비스 받을 이유도 없어요 가게에 손님 없는데는 이유가 있다고 생각했습니다 직원 사장 두분 다 아주 불친절 합니다  이런 리뷰 안쓰지만 서비스 개선 필요합니다  좋아요   맛있어요  마요네즈 조금 느끼한데 새우가 많아서 좋 네요 자리는 좁지만 회전율은 빠른편  음식도 빨리나 와요 새우탁틴 새우가 큼직큼직 맛있었어요   항상 친절하고  맛있는 곳 카페는 생각한거보다 조금 좁지만 분위기좋아용 쿠키 너무너무 맛있고 드립백 컵이랑 세트도 넘 에쁘구 맛있어요   근데 조금만 더 진했으면 좋겠어요           맛은 있는데 가격대가 높고 양이 적은 듯 음식을 시켜 도  인 잔 필수인게 아쉬움 그리고 내부가 좁다보니  너무 시끄러움  음식 나오는데   분 기다림  미    요거트그래놀라는 가격대비 너무너무 별로에요      새우타르틴은 그저 그래욤    이너프   그래놀라 맛있어요 맛잇어용
